{
  "version": "0.1",
  "author": "WaterTian",
  "license": "MIT",
  "policy": {
    "paid_api": false,
    "first_party_only": true,
    "allow_rejected_candidates": false,
    "required_status": "approved_public_gallery"
  },
  "assets": [
    {
      "case_id": 1,
      "id": "product-commerce-visual-aurora-mini",
      "template_id": "product-commerce-visual",
      "image_path": "gallery/images/product-commerce-visual-aurora-mini.png",
      "prompt_path": "gallery/prompts/product-commerce-visual-aurora-mini.md",
      "image_sha256": "733eea211d825686f89d737773132f59fd166069462030dbf5bec937aabc362b",
      "prompt_sha256": "83693dd7b4a1f530abb690451c8885d4a6a826a6b89876061680358153f552fc",
      "width": 1672,
      "height": 941,
      "format": "PNG",
      "mode": "RGB",
      "provider_path": "codex-built-in-imagegen",
      "paid_api": false,
      "first_party": true,
      "input_assets": [],
      "status": "approved_public_gallery"
    },
    {
      "case_id": 2,
      "id": "character-design-sheet-mara-venn",
      "template_id": "character-design-sheet",
      "image_path": "gallery/images/character-design-sheet-mara-venn.png",
      "prompt_path": "gallery/prompts/character-design-sheet-mara-venn.md",
      "image_sha256": "0f2ca7dd82270d1bf6c342908d0e652804e594a0bb0f8d53f9be00f7c41d96e3",
      "prompt_sha256": "f341ab2ceaf630e907158993807f4f2bd7ccb2c1ef754a877eeae8a0602dea63",
      "width": 1672,
      "height": 941,
      "format": "PNG",
      "mode": "RGB",
      "provider_path": "codex-built-in-imagegen",
      "paid_api": false,
      "first_party": true,
      "input_assets": [],
      "status": "approved_public_gallery"
    },
    {
      "case_id": 3,
      "id": "realistic-photography-mara-venn",
      "template_id": "realistic-photography",
      "image_path": "gallery/images/realistic-photography-mara-venn.png",
      "prompt_path": "gallery/prompts/realistic-photography-mara-venn.md",
      "image_sha256": "654ea248670e831a599f14ddd4c79c709c2d1be4bd2bbb1c7fc1ce6af0aaa6ae",
      "prompt_sha256": "a9f3638bbece7471a946a9a5c4e87cbf80a5b14d8a12ad8f41aad0c2942100e6",
      "width": 1122,
      "height": 1402,
      "format": "PNG",
      "mode": "RGB",
      "provider_path": "codex-built-in-imagegen",
      "paid_api": false,
      "first_party": true,
      "input_assets": [
        {
          "path": "gallery/images/character-design-sheet-mara-venn.png",
          "role": "project-created character identity and wardrobe reference"
        }
      ],
      "status": "approved_public_gallery"
    },
    {
      "case_id": 4,
      "id": "realistic-fashion-lookbook-noa-reyes",
      "template_id": "realistic-fashion-lookbook",
      "image_path": "gallery/images/realistic-fashion-lookbook-noa-reyes.png",
      "prompt_path": "gallery/prompts/realistic-fashion-lookbook-noa-reyes.md",
      "image_sha256": "1a04934321777072af1f321f8caece2207723371d50eb53a7614e3d74015c845",
      "prompt_sha256": "f1e58cf74f4176aa1c81569359c6731648e6a9765401e6272b0d0f1774d90bc9",
      "width": 1122,
      "height": 1402,
      "format": "PNG",
      "mode": "RGB",
      "provider_path": "codex-built-in-imagegen",
      "paid_api": false,
      "first_party": true,
      "input_assets": [],
      "status": "approved_public_gallery"
    },
    {
      "case_id": 5,
      "id": "exploded-product-diagram-orbital-frame-one",
      "template_id": "exploded-product-diagram",
      "image_path": "gallery/images/exploded-product-diagram-orbital-frame-one.png",
      "prompt_path": "gallery/prompts/exploded-product-diagram-orbital-frame-one.md",
      "image_sha256": "4a578b623e20895aa6873f084f18c5e0e86bd93ce511c1a8ac44ed1f0360bc41",
      "prompt_sha256": "6ec712b48813d3d56611bccefa720de5e3569fb75bd86250256d150fd66ebe8e",
      "width": 1122,
      "height": 1402,
      "format": "PNG",
      "mode": "RGB",
      "provider_path": "codex-built-in-imagegen",
      "paid_api": false,
      "first_party": true,
      "input_assets": [],
      "status": "approved_public_gallery"
    },
    {
      "case_id": 6,
      "id": "quiet-editorial-portrait-mira-kang",
      "template_id": "quiet-editorial-portrait",
      "image_path": "gallery/images/quiet-editorial-portrait-mira-kang.png",
      "prompt_path": "gallery/prompts/quiet-editorial-portrait-mira-kang.md",
      "image_sha256": "d69c6f58737ecb46d7c795cad75e35d932ad47c386a9584daabff6eca8449300",
      "prompt_sha256": "019864f7f5236392193cd72593790c0548394864fffff3a5bb343e26aeb2fd02",
      "width": 941,
      "height": 1672,
      "format": "PNG",
      "mode": "RGB",
      "provider_path": "codex-built-in-imagegen",
      "paid_api": false,
      "first_party": true,
      "input_assets": [],
      "status": "approved_public_gallery"
    },
    {
      "case_id": 7,
      "id": "realistic-motion-editorial-leo-navarro",
      "template_id": "realistic-motion-editorial",
      "image_path": "gallery/images/realistic-motion-editorial-leo-navarro.png",
      "prompt_path": "gallery/prompts/realistic-motion-editorial-leo-navarro.md",
      "image_sha256": "83dd2ccd6a3d568bdcf909ac02465dc216f8fb5eeca7afa05497ab4da1215a71",
      "prompt_sha256": "e72ba9918352ab6ea445bc739b5ebe7062469d243181b5af07fd354a4582fb54",
      "width": 1003,
      "height": 1568,
      "format": "PNG",
      "mode": "RGB",
      "provider_path": "codex-built-in-imagegen",
      "paid_api": false,
      "first_party": true,
      "input_assets": [],
      "status": "approved_public_gallery"
    },
    {
      "case_id": 8,
      "id": "documentary-craft-portrait-anika-rowan",
      "template_id": "documentary-craft-portrait",
      "image_path": "gallery/images/documentary-craft-portrait-anika-rowan.png",
      "prompt_path": "gallery/prompts/documentary-craft-portrait-anika-rowan.md",
      "image_sha256": "a6fe40c2889569c98dfa15e4015db843c4f83e51299bccff50b28b3bef495998",
      "prompt_sha256": "810491bb52aeaf957d3c066a1a7b104459736416288ec7ff0725981b179634bd",
      "width": 864,
      "height": 1821,
      "format": "PNG",
      "mode": "RGB",
      "provider_path": "codex-built-in-imagegen",
      "paid_api": false,
      "first_party": true,
      "input_assets": [],
      "status": "approved_public_gallery"
    },
    {
      "case_id": 9,
      "id": "documentary-music-rehearsal-elise-moreau",
      "template_id": "documentary-music-rehearsal",
      "image_path": "gallery/images/documentary-music-rehearsal-elise-moreau.png",
      "prompt_path": "gallery/prompts/documentary-music-rehearsal-elise-moreau.md",
      "image_sha256": "f38898f9be919dd3426f0ee28e40c1ebfa9a789fb0ec2245e176e4934cbbb1db",
      "prompt_sha256": "9790b3a2f9f527278557afdc87edd9869c0e738d73c9ab7a89096c04b4e4dc3e",
      "width": 864,
      "height": 1821,
      "format": "PNG", "mode": "RGB", "provider_path": "codex-built-in-imagegen", "paid_api": false, "first_party": true, "input_assets": [], "status": "approved_public_gallery"
    },
    {
      "case_id": 10,
      "id": "mature-documentary-portrait-nora-vale",
      "template_id": "mature-documentary-portrait",
      "image_path": "gallery/images/mature-documentary-portrait-nora-vale.png",
      "prompt_path": "gallery/prompts/mature-documentary-portrait-nora-vale.md",
      "image_sha256": "28b2cc6e8d5426b6e2c7272d20120ffdf799bda8307f2f8c0768ee4e332b0766",
      "prompt_sha256": "402290255bb7227c49b8d5915ba1f9337d4d3bb9eca0b5e22f7802fae218bc47",
      "width": 864,
      "height": 1821,
      "format": "PNG",
      "mode": "RGB",
      "provider_path": "codex-built-in-imagegen",
      "paid_api": false,
      "first_party": true,
      "input_assets": [],
      "status": "approved_public_gallery"
    },
    {
      "case_id": 11,
      "id": "realistic-hairstyle-variation-board-maris-vale",
      "template_id": "realistic-hairstyle-variation-board",
      "image_path": "gallery/images/realistic-hairstyle-variation-board-maris-vale.png",
      "prompt_path": "gallery/prompts/realistic-hairstyle-variation-board-maris-vale.md",
      "image_sha256": "10563bdee4389b41349915dc0c9b793a56b4534b725fd03cfe1a479a3308e209",
      "prompt_sha256": "38c5563015b68d7478cf7807f218320b2da1fa033a0591312edb474fab221ab8",
      "width": 972,
      "height": 1619,
      "format": "PNG",
      "mode": "RGB",
      "provider_path": "codex-built-in-imagegen",
      "paid_api": false,
      "first_party": true,
      "input_assets": [],
      "status": "approved_public_gallery"
    },
    {
      "case_id": 12,
      "id": "concept-poster-visual-plate-solstice-void",
      "template_id": "concept-poster-visual-plate",
      "image_path": "gallery/images/concept-poster-visual-plate-solstice-void.png",
      "prompt_path": "gallery/prompts/concept-poster-visual-plate-solstice-void.md",
      "image_sha256": "36995b2fc02b5338255a9c3d1e63a1314fb9e669432dc57b96e72fc0c40761fe",
      "prompt_sha256": "f2a0b41d075f2837409bfde408bba1ed2b0cadabc5a47231c0a1d841bb54879a",
      "width": 1024,
      "height": 1536,
      "format": "PNG",
      "mode": "RGB",
      "provider_path": "codex-built-in-imagegen",
      "paid_api": false,
      "first_party": true,
      "input_assets": [],
      "status": "approved_public_gallery"
    },
    {
      "case_id": 13,
      "id": "tonal-studio-editorial-portrait-arden-sloane",
      "template_id": "tonal-studio-editorial-portrait",
      "image_path": "gallery/images/tonal-studio-editorial-portrait-arden-sloane.png",
      "prompt_path": "gallery/prompts/tonal-studio-editorial-portrait-arden-sloane.md",
      "image_sha256": "54e1154f343baabc24d1c3c93909654a5218500ae52ac40bc47174a09a2b8cde",
      "prompt_sha256": "49125c962d4c22e191d3e895e5e0b62a4f9a294b7b955332eac41487f8961f49",
      "width": 1023,
      "height": 1537,
      "format": "PNG",
      "mode": "RGB",
      "provider_path": "codex-built-in-imagegen",
      "paid_api": false,
      "first_party": true,
      "input_assets": [],
      "status": "approved_public_gallery"
    },
    {